ticketSeq;subject;ticketType.name;startDateT;endDateT;assignedToUser.name;prioritySelect;statusSelect;progressSelect
TKT0001;Ou télécharger les sources de l'ERP ?;Support technique;26/02/18 18:30;26/02/18 20:30;Kevin DEMOERP;1;2;100
TKT0002;Comment accéder à la doc technique ? ;Support technique;27/02/18 13:30;27/02/18 16:30;Kevin DEMOERP;1;2;100
TKT0003;Impossible de se connecter avec le user Admin;Support technique;27/02/18 14:30;28/02/18 14:00;Cyril MARCHAL;3;2;100
TKT0004;Comment rattacher une pièce jointe ?;Support fonctionnel;27/02/18 18:30;;Charles DEMOCRM;2;1;10
TKT0005;Comment effectuer une recherche avancée ? ;Support fonctionnel;28/02/18 13:30;;Charles DEMOCRM;3;0;
TKT0006;Comment effectuer une mise à jour en masse d'enregistrements ?;Support fonctionnel;28/02/18 14:00;;Kevin DEMOERP;4;0;
