"importId";"clpCode";"clpDesignation";"clpPictogram_filename"
1;"GHS07";"Irritant for skin, eyes, sensitizer, toxic in low doses";"img//hazard-pictogram/GHS-07.png"
2;"GHS08";"Carcinogenic, mutagenic, reprotoxic, respiratory sensitizer, etc.";"img//hazard-pictogram/GHS-08.png"
3;"GHS09";"Dangerous to the aquatic environment";"img//hazard-pictogram/GHS-09.png"
4;"GHS06";"Acute toxicity (deadly or toxic in very low doses)";"img//hazard-pictogram/GHS-06.png"
5;"GHS05";"Corrosive for skin, eyes, metals";"img//hazard-pictogram/GHS-05.png"
6;"GHS02";"Inflammable, self-heating, reactive";"img//hazard-pictogram/GHS-02.png"
7;"GHS01";"Explosive, self-reactive, organic peroxide";"img//hazard-pictogram/GHS-01.png"
8;"GHS03";"Fuel (promotes combustion)";"img//hazard-pictogram/GHS-03.png"
9;"GHS04";"Pressure gas";"img//hazard-pictogram/GHS-04.png"
