"importId";"name";"description"
1;"Action en cours";"Relance tél. en cours, en attente retour client​<br>Fixer une date de prochaine action"
2;"Erreur admin";"Erreur de facturation, non réception de la facture, …​<br>Envoi du duplicata ou annulation / refacturation"
3;"MED / RAR";"Pré-contentieux / Contentieux"
4;"LJ/RJ";"Client en Liquidation / Redressement judiciaire"
5;"Litige Prix";"Contestation du prix​<br>Info du commercial par la compta"
6;"Litige Quantité";"Contestation des quantités reçues​<br>Info du commercial par la compta"
7;"Litige Qualité";"Contestation de la prestation / marchandise reçue​<br>Info du service qualité de la division"
8;"Exclusion commerciale";"Décision du Business Leader ou du RAF d’exclure un client à la relance"
